{
 "schema_version": "ire-feed/v2",
 "schema_url": "https://raw.githubusercontent.com/Pukujan/inference-recommendation-engine/data/ire-feed/feed/v2/schema.json",
 "generated_at": "2026-10-09T17:25:18Z",
 "day_et": "2026-10-09",
 "stale_after": "2026-10-11T05:25:14Z",
 "code_commit": "e9e8b2636c3e460234dde315717f5a80af9aa6e9",
 "source_repo": "https://github.com/Pukujan/inference-recommendation-engine",
 "snapshot_sha256": "87e0c7c36317e29db4ad3dfbf03b898b0a189f8359c9f84a851fcb6d910d64c6",
 "sources": {
  "top20": {
   "file": "operational/telemetry/gravebuster/pipeline/ihub/lists/research_model_top20_recommendations.csv",
   "sha256": "8b6582137b8c96df7bbb00da90f0bfb8d25c3a632c8e148a2c989a73a2a256cb",
   "sidecar_sha256": "b5fc4f5003d6783362acc51bd83da4e5d387d257ac585901118091b14e0eb508"
  },
  "frontier": {
   "file": "operational/telemetry/gravebuster/pipeline/ihub/lists/research_model_frontier_recommendations.json",
   "sha256": "c41f1b5491e69e8f6e9c011b509fd48fe62dee5636b462e8430e9d88a0fe0a7a"
  },
  "licences": {
   "file": "operational/telemetry/gravebuster/pipeline/ihub/model_licences.v1.json",
   "sha256": "26ab3ea4c66b30032d096be9bbe74a8de5a24891a59311b92d9714d143c16445"
  },
  "utility": {
   "file": "operational/telemetry/gravebuster/pipeline/ihub/lists/research_model_utility_recommendations.csv",
   "sha256": "f719278c9eb4e446409a71f642e99c377c11a38107c8feaf2b6da3864a5d7ed3",
   "sidecar_sha256": "2ea3b5fe00c34737eb751139ba1fea5c6f0a10250b92a7231166eed35a0926ab"
  }
 },
 "open_weight_only": true,
 "licences_url": "https://github.com/Pukujan/inference-recommendation-engine/blob/main/operational/telemetry/gravebuster/pipeline/ihub/model_licences.v1.json",
 "notice": "Read-only daily picks from IRE. The cheap and strongest_open tiers are open-weight models only; every entry there has open_weight true and names its licence and where the weights are published. The utility tier (image and multimodal models) records the open-weight verdict per entry: open_weight true when a published licence and weights were verified, open_weight null when the family is listed but its licence is unverified (such a row is never recommended). No closed-weight family appears in any tier. Prices are the lowest listed ask in USD per 1M tokens at as_of (the served price can be higher), health is InferHub's public, platform-wide status, and capability is a low-confidence prior. Bring your own InferHub key; this feed never contains one. Treat the feed as stale after stale_after.",
 "tiers": {
  "cheap": {
   "list": "top20",
   "as_of": "2026-10-09T17:25:14Z",
   "snapshot_sha256": "87e0c7c36317e29db4ad3dfbf03b898b0a189f8359c9f84a851fcb6d910d64c6",
   "description": "Open-weight models from IRE's cheap Top 20, ranked; gated rows stay visible with their gate_reasons, recommended marks the usable ones.",
   "entries": [
    {
     "rank": 1,
     "model_family": "DeepSeek V4.1 Flash",
     "vendor": "DeepSeek",
     "recommended": true,
     "gate_reasons": [],
     "best_route": "cb/deepseek-v4.1-flash",
     "price_usd_per_mtok": {
      "input": 0.00015,
      "output": 0.0006,
      "basis": "best route lowest listed ask at as_of"
     },
     "health": {
      "status": "healthy",
      "confidence": "medium",
      "reasons": [
       "model alias operational (24h 99.71%)",
       "rail_state=operational"
      ]
     },
     "confidence": "low",
     "tier": "upper_mid",
     "capability_score_100": 39.456,
     "price_regime": "near_free",
     "system_prompt_handling": "upstream_note",
     "preferred_endpoint": null,
     "caveats": [
      "InferHub rail note: Adds a short system note ahead of your system prompt (formatting guidance, plus an identity line when a known coding agent such as Claude Code or Codex is detected) and may reword agent and product identity wording inside it. You can turn this off per API key: Dashboard → API keys → Prompt filtering. Always applied: multiple system messages are merged into one, and \"You are a helpful assistant.\" is used when you send none."
     ],
     "routes": [
      "cb/deepseek-v4.1-flash",
      "alicn/deepseek-v4.1-flash",
      "ali/deepseek-v4.1-flash",
      "cbcn/deepseek-v4.1-flash",
      "cmc/deepseek/deepseek-v4.1-flash",
      "cp/cline-pass/deepseek-v4.1-flash",
      "ocg/deepseek-v4.1-flash"
     ],
     "open_weight": true,
     "licence": {
      "name": "MIT",
      "url": "https://huggingface.co/deepseek-ai/DeepSeek-V4.1-Flash/blob/main/LICENSE",
      "weights_url": "https://huggingface.co/deepseek-ai/DeepSeek-V4.1-Flash"
     }
    },
    {
     "rank": 2,
     "model_family": "GLM 5.3 Flash",
     "vendor": "Z.ai",
     "recommended": true,
     "gate_reasons": [],
     "best_route": "zai/glm-5.3-flash",
     "price_usd_per_mtok": {
      "input": 0.00015,
      "output": 0.0005,
      "basis": "best route lowest listed ask at as_of"
     },
     "health": {
      "status": "healthy",
      "confidence": "medium",
      "reasons": [
       "model alias operational (24h 99.99%)",
       "rail_state=operational"
      ]
     },
     "confidence": "low",
     "tier": "top",
     "capability_score_100": 41.807,
     "price_regime": "near_free",
     "system_prompt_handling": "unspecified",
     "preferred_endpoint": null,
     "caveats": [],
     "routes": [
      "zai/glm-5.3-flash",
      "cbcn/glm-5.3-flash",
      "cp/cline-pass/glm-5.3-flash",
      "cp/zai/glm-5.3-flash",
      "ocg/glm-5.3-flash"
     ],
     "open_weight": true,
     "licence": {
      "name": "MIT",
      "url": "https://huggingface.co/zai-org/GLM-5.3-Flash/blob/main/LICENSE",
      "weights_url": "https://huggingface.co/zai-org/GLM-5.3-Flash"
     }
    },
    {
     "rank": 3,
     "model_family": "MiniMax M3",
     "vendor": "MiniMax",
     "recommended": true,
     "gate_reasons": [],
     "best_route": "cb/minimax-m3",
     "price_usd_per_mtok": {
      "input": 0.0033,
      "output": 0.0132,
      "basis": "best route lowest listed ask at as_of"
     },
     "health": {
      "status": "healthy",
      "confidence": "medium",
      "reasons": [
       "model alias operational (24h 99.73%)",
       "rail_state=operational"
      ]
     },
     "confidence": "low",
     "tier": "mid",
     "capability_score_100": 29.22,
     "price_regime": "near_free",
     "system_prompt_handling": "upstream_note",
     "preferred_endpoint": null,
     "caveats": [
      "InferHub rail note: Adds a short system note ahead of your system prompt (formatting guidance, plus an identity line when a known coding agent such as Claude Code or Codex is detected) and may reword agent and product identity wording inside it. You can turn this off per API key: Dashboard → API keys → Prompt filtering. Always applied: multiple system messages are merged into one, and \"You are a helpful assistant.\" is used when you send none."
     ],
     "routes": [
      "cb/minimax-m3",
      "cbcn/minimax-m3",
      "cp/cline-pass/minimax-m3",
      "mm/MiniMax-M3",
      "mmcn/MiniMax-M3",
      "ocg/minimax-m3"
     ],
     "open_weight": true,
     "licence": {
      "name": "MiniMax Community License (commercial use has conditions)",
      "url": "https://huggingface.co/MiniMaxAI/MiniMax-M3/blob/main/LICENSE",
      "weights_url": "https://huggingface.co/MiniMaxAI/MiniMax-M3"
     }
    },
    {
     "rank": 4,
     "model_family": "Qwen3.8 Flash",
     "vendor": "Alibaba/Qwen",
     "recommended": true,
     "gate_reasons": [],
     "best_route": "alicn/qwen3.8-flash",
     "price_usd_per_mtok": {
      "input": 0.00015,
      "output": 0.00047,
      "basis": "best route lowest listed ask at as_of"
     },
     "health": {
      "status": "healthy",
      "confidence": "medium",
      "reasons": [
       "model alias operational (24h 99.98%)",
       "rail_state=operational"
      ]
     },
     "confidence": "low",
     "tier": "upper_mid",
     "capability_score_100": 39.822,
     "price_regime": "near_free",
     "system_prompt_handling": "unspecified",
     "preferred_endpoint": null,
     "caveats": [],
     "routes": [
      "alicn/qwen3.8-flash",
      "ali/qwen3.8-flash",
      "ocg/qwen3.8-flash"
     ],
     "open_weight": true,
     "licence": {
      "name": "Qwen Community License 1.0",
      "url": "https://huggingface.co/Qwen/Qwen3.8-Flash-Next/blob/main/LICENSE",
      "weights_url": "https://huggingface.co/Qwen/Qwen3.8-Flash-Next"
     }
    },
    {
     "rank": 5,
     "model_family": "DeepSeek V4 Flash",
     "vendor": "DeepSeek",
     "recommended": false,
     "gate_reasons": [
      "not_routing_eligible"
     ],
     "best_route": "cbcn/deepseek-v4-flash",
     "price_usd_per_mtok": {
      "input": 0.00506,
      "output": 0.01518,
      "basis": "best route lowest listed ask at as_of"
     },
     "health": {
      "status": "degraded",
      "confidence": "medium",
      "reasons": [
       "model alias_state=major_outage (24h 58.42%), model-wide signal"
      ]
     },
     "confidence": "low",
     "tier": "upper_mid",
     "capability_score_100": 34.839,
     "price_regime": "near_free",
     "system_prompt_handling": "upstream_note",
     "preferred_endpoint": null,
     "caveats": [
      "InferHub rail note: Adds a short system note ahead of your system prompt (formatting guidance, plus an identity line when a known coding agent such as Claude Code or Codex is detected) and may reword agent and product identity wording inside it. You can turn this off per API key: Dashboard → API keys → Prompt filtering (with it off, this upstream may reject coding-agent prompts). Always applied: multiple system messages are merged into one, and \"You are a helpful assistant.\" is used when you send none."
     ],
     "routes": [
      "cbcn/deepseek-v4-flash",
      "cmc/deepseek/deepseek-v4-flash",
      "ocg/deepseek-v4-flash"
     ],
     "open_weight": true,
     "licence": {
      "name": "MIT",
      "url": "https://huggingface.co/deepseek-ai/DeepSeek-V4-Flash/blob/main/LICENSE",